{
  "coord" : {
    "lon" : -105.41,
    "lat" : 36.71
  },
  "weather" : [ {
    "id" : 804,
    "main" : "Clouds",
    "description" : "overcast clouds",
    "icon" : "04d"
  } ],
  "base" : "stations",
  "main" : {
    "temp" : 285.5,
    "pressure" : 1012,
    "humidity" : 39,
    "temp_min" : 280.93,
    "temp_max" : 288.71
  },
  "visibility" : 16093,
  "wind" : {
    "speed" : 5.7,
    "deg" : 230,
    "gust" : 10.3
  },
  "clouds" : {
    "all" : 85
  },
  "dt" : 1558554843,
  "sys" : {
    "type" : 1,
    "id" : 3371,
    "message" : 0.0058,
    "country" : "US",
    "sunrise" : 1558525769,
    "sunset" : 1558577245
  },
  "id" : 5485658,
  "name" : "Red River",
  "cod" : 200,
  "timezone" : -21600
}